{
  "$schema": "../schemas/plan-manifest.schema.json",
  "slug": "FEATURE_SLUG",
  "title": "Human-readable feature title",
  "sponsor": "<sponsor name>",
  "branch": "feature/FEATURE_SLUG",
  "created_at": "2024-01-01T00:00:00Z",
  "stage": "discovery",
  "stages_completed": [],
  "artifacts": {
    "prd": { "path": "PRD.md", "approved": false, "approved_at": null },
    "spec": { "path": "SPEC.md", "approved_at": null },
    "migrations": [],
    "source_files": [],
    "tests": []
  },
  "promised_in_spec": {
    "scenario_matrix": [],
    "navigation_surfaces": [],
    "consistency_anchors": []
  },
  "verification": {
    "scenarios_validated": null,
    "all_nav_surfaces_updated": null,
    "consistency_check_passed": null,
    "tests_passing": null,
    "build_passing": null,
    "type_check_passing": null
  },
  "links": {
    "pr_url": null,
    "issue_url": null
  }
}
